{"run":62,"commit":"48ba1fc","metric":260,"metrics":{},"status":"keep","description":"Made the cards-per-note density pill browseable so unusually dense capture weeks now let users jump directly into the visible week context instead of treating density as passive metadata.","timestamp":1775022292162,"segment":13,"confidence":3.670886075949367,"iterationTokens":2746}
{"run":63,"commit":"953b7ed","metric":261,"metrics":{},"status":"keep","description":"Visually emphasized the resume-last-capture shortcuts in both the guidance row and panel action row so missed-today users can spot the fastest recovery path without losing the existing latest-day browse affordance.","timestamp":1775022384719,"segment":13,"confidence":3.5609756097560976,"iterationTokens":3035}
{"run":64,"commit":"86d15e3","metric":262,"metrics":{},"status":"keep","description":"Added a panel-level Browse busiest day shortcut when the most active session differs from the latest one, keeping big import or generation bursts one click away from the top action row.","timestamp":1775022515178,"segment":13,"confidence":3.5421686746987953,"iterationTokens":4685}
{"run":65,"commit":"86d15e3","metric":262,"metrics":{},"status":"discard","description":"Tried date-anchoring the gap summary with the latest capture date so the recency cue required less cross-referencing, but the primary score stayed flat, so I discarded the wording-only pass.","timestamp":1775022591440,"segment":13,"confidence":3.4186046511627906,"iterationTokens":2048}
{"run":66,"commit":"03d593b","metric":263,"metrics":{},"status":"keep","description":"Date-anchored the gap pill so missed-today users see the latest capture date and recency in one glance instead of cross-referencing the rows to understand what the gap refers to.","timestamp":1775022796076,"segment":13,"confidence":3.6097560975609757,"iterationTokens":2048}
{"run":67,"commit":"03d593b","metric":262,"metrics":{},"status":"discard","description":"Tried renaming the panel-wide week shortcut to Browse last 7 days while keeping the date span visible, but it displaced the existing visible-week wording the rubric already recognized and reduced the primary score.","timestamp":1775022836077,"segment":13,"confidence":3.7,"iterationTokens":1559}
{"run":68,"commit":"a74bc5c","metric":265,"metrics":{},"status":"keep","description":"Clarified the recent-cards aggregation query by grouping on the days_ago alias, and documented that empty days should collapse into guidance instead of repeating raw 0 cards / 0 notes rows.","timestamp":1775022888883,"segment":13,"confidence":3.658536585365854,"iterationTokens":2446}
{"run":69,"commit":"a74bc5c","metric":265,"metrics":{},"status":"discard","description":"Tried aligning the top action row wording with the guidance banner by calling the latest-session shortcut Resume last capture everywhere, but the primary score stayed flat so I discarded the copy-only consistency change.","timestamp":1775022946627,"segment":13,"confidence":3.5714285714285716,"iterationTokens":2396}
{"run":70,"commit":"89a1024","metric":268,"metrics":{},"status":"keep","description":"Turned a leading Quiet stretch into a recovery surface with a Restart after quiet stretch action, so users can jump straight back into card creation from the exact point where recent momentum went missing.","timestamp":1775023056180,"segment":13,"confidence":3.642857142857143,"iterationTokens":4904}
{"run":71,"commit":"e9ef249","metric":271,"metrics":{},"status":"keep","description":"Marked a leading Quiet stretch as the Current gap and highlighted the row, so the collapsed empty-day summary now distinguishes the present momentum break from older quiet periods before offering a restart action.","timestamp":1775023132161,"segment":13,"confidence":3.5454545454545454,"iterationTokens":2868}
{"run":72,"commit":"5b73feb","metric":273,"metrics":{},"status":"keep","description":"Long current gaps now add an Import to rebuild momentum recovery link inside the Quiet stretch row, so multi-day lulls support both a quick restart and a larger catch-up capture path directly from the collapsed gap summary.","timestamp":1775023210537,"segment":13,"confidence":3.8536585365853657,"iterationTokens":2870}
{"run":73,"commit":"5a20b0d","metric":276,"metrics":{},"status":"keep","description":"Added a Restart after quiet day recovery action for single-day current gaps, so even a lone empty yesterday row now helps users resume capture instead of reading like passive empty history.","timestamp":1775023292405,"segment":13,"confidence":4.025,"iterationTokens":2742}
{"run":74,"commit":"bce0a0f","metric":278,"metrics":{},"status":"keep","description":"Made missed-today guidance explicitly describe a multi-day current gap with the last capture date, and let longer gaps offer import recovery from the banner so recovery reads like resuming a paused timeline instead of generic restart copy.","timestamp":1775023395546,"segment":13,"confidence":4.0246913580246915,"iterationTokens":3973}
{"run":75,"commit":"091831e","metric":281,"metrics":{},"status":"keep","description":"Added a paused-timeline insight state that calls out when capture has been idle since the latest active date and links straight back to that session, so current gaps are interpreted before users read the detailed rows.","timestamp":1775023533414,"segment":13,"confidence":4.256410256410256,"iterationTokens":3973}
{"run":76,"commit":"760a977","metric":284,"metrics":{},"status":"keep","description":"Added a just-started insight state so lightly active weeks are interpreted as the beginning of a streak, not lumped into the generic spread-across-days message, while still linking straight into the recent timeline.","timestamp":1775023598946,"segment":13,"confidence":4.3896103896103895,"iterationTokens":2727}
{"run":77,"commit":"28d322d","metric":290,"metrics":{},"status":"keep","description":"Made the top create CTA context-aware so the panel now says Create first card, Restart today, or Create another depending on the week's state, keeping the most obvious capture action aligned with the learner's actual next step.","timestamp":1775023690751,"segment":13,"confidence":4.487179487179487,"iterationTokens":3526}
{"run":78,"commit":"c2b4860","metric":292,"metrics":{},"status":"keep","description":"Added an Import more follow-up on non-latest busiest rows so high-volume import or generation sessions now offer a direct way to continue the same workflow from the row that represents that burst.","timestamp":1775023753133,"segment":13,"confidence":4.481012658227848,"iterationTokens":2502}
{"run":79,"commit":"91f7f9c","metric":296,"metrics":{},"status":"keep","description":"Extended the activity strip with current-gap highlighting and legend support, so empty bars immediately distinguish an active lull from older quiet history before users read the detailed rows.","timestamp":1775023852557,"segment":13,"confidence":4.7631578947368425,"iterationTokens":3193}
{"run":80,"commit":"8248692","metric":298,"metrics":{},"status":"keep","description":"Made the strip helper context-aware for current gaps, so when capture has paused the helper explicitly explains that dashed empty bars represent the active lull before users inspect the detailed rows.","timestamp":1775023917533,"segment":13,"confidence":4.753246753246753,"iterationTokens":2046}
{"run":81,"commit":"d56be32","metric":301,"metrics":{},"status":"keep","description":"Made the panel-level import CTA context-aware so it now says Import cards, Import more, or Import to rebuild momentum depending on whether the learner is starting fresh, continuing an active week, or recovering from a longer current gap.","timestamp":1775024054536,"segment":13,"confidence":4.769230769230769,"iterationTokens":3904}
{"run":82,"commit":"e2bf256","metric":302,"metrics":{},"status":"keep","description":"Added row-level Resume last capture links to current-gap quiet rows so recovery surfaces now support both restarting today and reopening the most recent active session without sending users to the broader week view.","timestamp":1775024152281,"segment":13,"confidence":4.675,"iterationTokens":3701}
{"run":83,"commit":"04cff90","metric":305,"metrics":{},"status":"keep","description":"Added a burst-then-gap insight state so weeks dominated by one big capture session and then a lull are interpreted explicitly, giving users a clearer explanation of the pattern before they choose whether to review or restart.","timestamp":1775024245458,"segment":13,"confidence":4.634146341463414,"iterationTokens":3250}
{"run":84,"commit":"52f3094","metric":306,"metrics":{},"status":"keep","description":"Upgraded the top busiest-day shortcut into a Review burst day action during burst-heavy weeks, so the panel-level recovery path explains why that session deserves attention instead of presenting it as generic busiest-day metadata.","timestamp":1775024320384,"segment":13,"confidence":4.602409638554217,"iterationTokens":2516}
{"run":85,"commit":"d894218","metric":310,"metrics":{},"status":"keep","description":"Gave the guidance block stateful styling for gap, burst, just-started, and consistent weeks so the next-step banner visually reinforces the week’s capture pattern before users read the full recovery or momentum message.","timestamp":1775024428665,"segment":13,"confidence":4.642857142857143,"iterationTokens":748}
{"run":86,"commit":"c405a2b","metric":312,"metrics":{},"status":"keep","description":"Made the strip helper explain burst emphasis too, so burst-heavy weeks now tell users directly that the highlighted bar marks the busiest session instead of leaving that interpretation solely to the legend.","timestamp":1775024501955,"segment":13,"confidence":4.690476190476191,"iterationTokens":2237}
{"run":87,"commit":"c4a40f5","metric":315,"metrics":{},"status":"keep","description":"Promoted multi-day lulls into an explicit Current gap summary pill, so the top-level metadata now uses the same recovery language as the strip and row states instead of hiding the pause behind a generic gap label.","timestamp":1775024642825,"segment":13,"confidence":4.545454545454546,"iterationTokens":4953}
{"run":88,"commit":"7152266","metric":318,"metrics":{},"status":"keep","description":"Added a browseable Latest summary pill so the metadata row keeps the most recent active day visible as a distinct orienting cue, even when the gap pill is focused on recovery wording.","timestamp":1775024816246,"segment":13,"confidence":4.511111111111111,"iterationTokens":4091}
{"run":89,"commit":"5d7de20","metric":322,"metrics":{},"status":"keep","description":"Added a panel-level Browse current gap week shortcut so longer lulls can be reviewed as a coherent stalled stretch from the top action row instead of only through row-level recovery affordances.","timestamp":1775024922386,"segment":13,"confidence":4.5,"iterationTokens":3679}
{"run":90,"commit":"5d7de20","metric":322,"metrics":{},"status":"discard","description":"Tried splitting the multi-day Current gap pill's browse target away from the Latest pill so the gap pill opened week context while Latest reopened the last active session, but the primary score stayed flat so I discarded the navigation-only reshuffle.","timestamp":1775025005113,"segment":13,"confidence":4.5,"iterationTokens":2293}
{"run":91,"commit":"5d7de20","metric":322,"metrics":{},"status":"discard","description":"Tried preserving a top-level Review burst day shortcut even when the burst day overlaps with the latest session, but the primary score stayed flat so I discarded the extra action-row emphasis.","timestamp":1775025081954,"segment":13,"confidence":4.5,"iterationTokens":2414}
{"run":92,"commit":"5d7de20","metric":322,"metrics":{},"status":"discard","description":"Tried keeping Browse week context directly on current-gap recovery rows alongside restart and resume actions, but the primary score stayed flat so I discarded the added row-level fallback action.","timestamp":1775025148838,"segment":13,"confidence":4.3125,"iterationTokens":2390}
{"run":93,"commit":"5d7de20","metric":322,"metrics":{},"status":"discard","description":"Tried upgrading the top Browse today shortcut to Review burst day when today is the dominant capture session, but the primary score stayed flat so I discarded the overlapping burst-label variant.","timestamp":1775025249190,"segment":13,"confidence":4.3125,"iterationTokens":2480}
{"run":94,"commit":"708727c","metric":323,"metrics":{},"status":"keep","description":"Preserved Latest session semantics even when the freshest capture is Today, so overlapping states remain visible on the most recent row and in the legend instead of letting the Today label hide that recency cue.","timestamp":1775025340142,"segment":13,"confidence":4.244897959183674,"iterationTokens":2765}
{"run":95,"commit":"9b7335c","metric":326,"metrics":{},"status":"keep","description":"Changed burst-dominant rows to use a Review burst day primary CTA, so the row for the biggest capture session now explains why that day matters instead of presenting it as a generic browse action.","timestamp":1775025580162,"segment":13,"confidence":4.22,"iterationTokens":3616}
{"run":96,"commit":"265ae63","metric":329,"metrics":{},"status":"keep","description":"Changed the latest non-today active row to use a Resume last capture primary CTA, so the freshest session now reads as the clear continuity path back into work instead of a generic browse action.","timestamp":1775025706624,"segment":13,"confidence":4.3232323232323235,"iterationTokens":2600}
{"run":97,"commit":"4e9d425","metric":330,"metrics":{},"status":"keep","description":"Added the latest session's card count to the browseable Latest pill, so the metadata row now shows not just when the freshest capture happened but also whether it was a small note or a substantial batch.","timestamp":1775025830047,"segment":13,"confidence":4.387755102040816,"iterationTokens":2919}
{"run":98,"commit":"4e9d425","metric":330,"metrics":{},"status":"discard","description":"Tried expanding the Latest pill from card count to cards-across-notes breadth so the metadata row distinguished small dense sessions from broader note batches, but the primary score stayed flat so I discarded the extra pill detail.","timestamp":1775025956233,"segment":13,"confidence":4.343434343434343,"iterationTokens":2380}
{"run":99,"commit":"b15ac2a","metric":330,"metrics":{},"status":"keep","description":"Added a Resume last capture fallback directly to the empty Today row, so a blank day can reconnect learners to the freshest session without making them leave the capture surface or hunt through the timeline first.","timestamp":1775026197372,"segment":13,"confidence":4.134615384615385,"iterationTokens":2919}
{"run":100,"commit":"4133c19","metric":331,"metrics":{},"status":"keep","description":"Added an Import more fallback to Today's row when today is also the burst-dominant session, so large generation/import workflows can continue directly from the freshest capture context instead of requiring a separate busiest-day jump.","timestamp":1775026409758,"segment":13,"confidence":4.153846153846154,"iterationTokens":3241}
{"run":101,"commit":"aeeeeb8","metric":332,"metrics":{},"status":"keep","description":"Made the Latest pill explicitly say when the freshest session is also the most active one, so learners can understand that the newest capture was also the dominant batch without cross-referencing the busiest-day metadata.","timestamp":1775026629154,"segment":13,"confidence":4.173076923076923,"iterationTokens":3407}
{"run":102,"commit":"05edaf5","metric":333,"metrics":{},"status":"keep","description":"Made the busiest summary pill explicitly say when the most active session is also the latest one, so users no longer need to reconcile separate metadata pills to understand that the freshest capture was also the biggest batch.","timestamp":1775026750378,"segment":13,"confidence":4.113207547169812,"iterationTokens":2218}
{"run":103,"commit":"5064113","metric":340,"metrics":{},"status":"keep","description":"Added a Today-status meta pill that becomes a browseable today summary when cards exist and a lightweight create-today entry point when they do not, so learners can see and act on today's capture status without scanning the strip or row list first.","timestamp":1775026977712,"segment":13,"confidence":4.166666666666667,"iterationTokens":3243}
{"run":104,"commit":"6261f65","metric":342,"metrics":{},"status":"keep","description":"Made the empty Today pill switch from ready-to-capture to ready-to-restart language when the week already has activity, so a blank day reads like continuity recovery instead of a first-time setup state.","timestamp":1775027111927,"segment":13,"confidence":4.165137614678899,"iterationTokens":2351}
{"run":105,"commit":"bda5fad","metric":343,"metrics":{},"status":"keep","description":"Made the Today-status pill explicitly say when today's capture is also the most active session, so learners can understand that the current day is the dominant batch without cross-referencing the busiest-day metadata.","timestamp":1775027208355,"segment":13,"confidence":4.1454545454545455,"iterationTokens":2042}
{"run":106,"commit":"bda5fad","metric":343,"metrics":{},"status":"discard","description":"Tried marking the blank Today row itself as Current gap when recent activity existed, but the primary score stayed flat so I discarded the extra recovery badge on today's row.","timestamp":1775027336524,"segment":13,"confidence":4.108108108108108,"iterationTokens":2378}
{"run":107,"commit":"bda5fad","metric":343,"metrics":{},"status":"discard","description":"Tried adding visible gap length to the panel-level Browse current gap week shortcut so longer breaks were explicit before click, but the primary score stayed flat so I discarded the extra label detail.","timestamp":1775027463910,"segment":13,"confidence":4.071428571428571,"iterationTokens":2448}
{"run":108,"commit":"e2a10b7","metric":344,"metrics":{},"status":"keep","description":"Expanded the Today-status pill to show today's cards-across-notes summary, so learners can judge whether today reflects a quick capture or a broader batch without leaving the meta row.","timestamp":1775027751725,"segment":13,"confidence":4.089285714285714,"iterationTokens":4372}
{"run":109,"commit":"33f56ea","metric":348,"metrics":{},"status":"keep","description":"Added stateful Today-pill styling and aligned its title language with the pill's actual state, so ready-to-capture, ready-to-restart, active-today, and most-active-today states are visually and semantically distinct before users read the rest of the panel.","timestamp":1775027922650,"segment":13,"confidence":4.160714285714286,"iterationTokens":3757}
{"run":110,"commit":"72d1446","metric":350,"metrics":{},"status":"keep","description":"Added overlap styling to the Latest and Busiest pills when they refer to the same session, so the metadata row visually reinforces that the freshest capture and the biggest batch are the same event instead of only saying it in text.","timestamp":1775028163265,"segment":13,"confidence":4.051724137931035,"iterationTokens":6918}
{"run":111,"commit":"72d1446","metric":350,"metrics":{},"status":"discard","description":"Tried giving the panel-level visible-week shortcut a Browse last 7 days title/assistive label while keeping the concrete date range in the visible text, but the primary score stayed flat so I discarded the wording/accessibility-only refinement.","timestamp":1775028347658,"segment":13,"confidence":3.9166666666666665,"iterationTokens":5110}
{"run":112,"commit":"2382b2b","metric":352,"metrics":{},"status":"keep","description":"Added stronger long-gap emphasis to the current-gap pill and shortcut so longer breaks are visually distinguished from brief stumbles, helping the panel communicate recovery urgency before users parse the full text.","timestamp":1775028543409,"segment":13,"confidence":3.9831932773109244,"iterationTokens":3934}
{"run":113,"commit":"a452738","metric":355,"metrics":{},"status":"keep","description":"Made the empty Today pill distinguish first-time capture from restart by switching to Start this week's timeline when the visible week is still empty, so new capture and recovery states no longer share the same blank-day language.","timestamp":1775028683694,"segment":13,"confidence":4.067796610169491,"iterationTokens":3053}
