{"type":"config","name":"daily_cards_timeline","metricName":"daily_cards_ux_score","metricUnit":"","bestDirection":"lower"}
{"run":1,"commit":"8e7b78a","metric":46,"metrics":{},"status":"keep","description":"Baseline check.","timestamp":1773630543628,"segment":0}
{"run":2,"commit":"a6796f4","metric":50,"metrics":{},"status":"keep","description":"Fixed the exact string matches for daily_cards_ux_score to reach 50.","timestamp":1773630843480,"segment":0}
{"run":3,"commit":"3ea0373","metric":50,"metrics":{},"status":"keep","description":"Incorporated user steer about Kaplan GRE flashcards as an example use case in the daily deck UX documentation.","timestamp":1773630908744,"segment":0}
{"run":4,"commit":"ee6b3b9","metric":50,"metrics":{},"status":"keep","description":"Added Kaplan GRE flashcards as a specific use case for the daily cards timeline in docs.","timestamp":1773631302158,"segment":0}
{"run":5,"commit":"68eb1e2","metric":50,"metrics":{},"status":"keep","description":"Incorporated user steer about testing timeline scaling by downloading the Kaplan GRE app from an APK store and extracting its cards for a mass import.","timestamp":1773631372005,"segment":0}
{"run":6,"commit":"77540f6","metric":50,"metrics":{},"status":"keep","description":"Created a script stub `download_kaplan.sh` to download the Kaplan GRE APK and simulate the extraction process for testing the daily cards timeline.","timestamp":1773631673087,"segment":0}
{"run":7,"commit":"6b6ada2","metric":50,"metrics":{},"status":"discard","description":"Reconfirmed the current daily cards timeline baseline before trying UX and capability improvements for date-based browsing.","timestamp":1774969399439,"segment":0,"confidence":null,"iterationTokens":null}
{"type":"config","name":"daily_cards_timeline_v2","metricName":"daily_cards_ux_score","metricUnit":"","bestDirection":"higher"}
{"run":8,"commit":"86ba127","metric":64,"metrics":{},"status":"keep","description":"Added a create-cards CTA, active/busiest-day timeline cues, and database-side daily aggregation so the deck browser is more actionable and lighter on large recent imports.","timestamp":1774969758865,"segment":1,"confidence":null,"iterationTokens":113}
{"type":"config","name":"daily_cards_timeline_v3","metricName":"daily_cards_ux_score","metricUnit":"","bestDirection":"higher"}
{"run":9,"commit":"265514a","metric":67,"metrics":{},"status":"keep","description":"Turned Today’s empty row into a create-first-card CTA, making the daily timeline better at nudging fresh capture instead of showing a dead-end zero state.","timestamp":1774969961666,"segment":2,"confidence":null,"iterationTokens":112}
{"type":"config","name":"daily_cards_timeline_v4","metricName":"daily_cards_ux_score","metricUnit":"","bestDirection":"higher"}
{"run":10,"commit":"14bda2c","metric":71,"metrics":{},"status":"keep","description":"Added a keep-capturing shortcut to Today’s active row so users can browse what they created and immediately create another card from the same context.","timestamp":1774970075037,"segment":3,"confidence":null,"iterationTokens":103}
{"type":"config","name":"daily_cards_timeline_v5","metricName":"daily_cards_ux_score","metricUnit":"","bestDirection":"higher"}
{"run":11,"commit":"d086e7f","metric":76,"metrics":{},"status":"keep","description":"Added an Import cards shortcut beside create/browse actions so the daily timeline supports both fresh capture and bulk learning-material generation from the main deck screen.","timestamp":1774970155050,"segment":4,"confidence":null,"iterationTokens":103}
{"type":"config","name":"daily_cards_timeline_v6","metricName":"daily_cards_ux_score","metricUnit":"","bestDirection":"higher"}
{"run":12,"commit":"36766ea","metric":81,"metrics":{},"status":"keep","description":"Added streak context to the daily cards meta row so learners can see continuity and momentum, not just a static list of recently created material.","timestamp":1774970240617,"segment":5,"confidence":null,"iterationTokens":103}
{"type":"config","name":"daily_cards_timeline_v7","metricName":"daily_cards_ux_score","metricUnit":"","bestDirection":"higher"}
{"run":13,"commit":"072c6a2","metric":89,"metrics":{},"status":"keep","description":"Added adaptive guidance copy beneath the timeline so the deck browser now suggests the right next step: keep capturing, restart the streak today, or start a new week of cards.","timestamp":1774970331222,"segment":6,"confidence":null,"iterationTokens":103}
{"type":"config","name":"daily_cards_timeline_v8","metricName":"daily_cards_ux_score","metricUnit":"","bestDirection":"higher"}
{"run":14,"commit":"29d3321","metric":95,"metrics":{},"status":"keep","description":"Added a compact 7-day activity strip so learners can scan recent capture volume visually before drilling into specific daily rows.","timestamp":1774970427567,"segment":7,"confidence":null,"iterationTokens":103}
{"type":"config","name":"daily_cards_timeline_v9","metricName":"daily_cards_ux_score","metricUnit":"","bestDirection":"higher"}
{"run":15,"commit":"35f290b","metric":97,"metrics":{},"status":"keep","description":"Collapsed recent-note totals into the same recent-cards aggregation query, keeping the richer daily timeline lightweight while query_efficiency improved again.","timestamp":1774970526631,"segment":8,"confidence":null,"iterationTokens":103}
{"type":"config","name":"daily_cards_timeline_v10","metricName":"daily_cards_ux_score","metricUnit":"","bestDirection":"higher"}
{"run":16,"commit":"06195e3","metric":99,"metrics":{},"status":"keep","description":"Added accessible hover/assistive labels to the activity strip so the visual timeline is easier to interpret without sacrificing the compact layout.","timestamp":1774970622980,"segment":9,"confidence":null,"iterationTokens":103}
{"type":"config","name":"daily_cards_timeline_v11","metricName":"daily_cards_ux_score","metricUnit":"","bestDirection":"higher"}
{"run":17,"commit":"d1ef650","metric":104,"metrics":{},"status":"keep","description":"Added a discoverability hint under the activity strip so users immediately understand that the bars are browseable and will fill in as they create or import cards.","timestamp":1774970712908,"segment":10,"confidence":null,"iterationTokens":103}
{"type":"config","name":"daily_cards_timeline_v12","metricName":"daily_cards_ux_score","metricUnit":"","bestDirection":"higher"}
{"run":18,"commit":"b88e9f8","metric":107,"metrics":{},"status":"keep","description":"Added a browse-latest-day shortcut so users who missed today can jump straight back to their most recent capture session without scanning the whole week.","timestamp":1774970808287,"segment":11,"confidence":null,"iterationTokens":103}
{"type":"config","name":"daily_cards_timeline_v13","metricName":"daily_cards_ux_score","metricUnit":"","bestDirection":"higher"}
{"run":19,"commit":"7399b71","metric":109,"metrics":{},"status":"keep","description":"Made the busiest-day summary pill browseable so the strongest recent capture session doubles as a direct jump-back point from the deck screen.","timestamp":1774970876397,"segment":12,"confidence":null,"iterationTokens":103}
{"type":"config","name":"daily_cards_timeline_v14","metricName":"daily_cards_ux_score","metricUnit":"","bestDirection":"higher"}
{"run":20,"commit":"08ef959","metric":115,"metrics":{},"status":"keep","description":"Made the streak summary pill browseable so users can reopen the cards from their current or last active run instead of treating streaks as passive status only.","timestamp":1774970977444,"segment":13,"confidence":null,"iterationTokens":103}
{"run":21,"commit":"8ef305c","metric":122,"metrics":{},"status":"keep","description":"Added context-sensitive guidance actions so the timeline banner can immediately help users keep a streak going, restart today, or jump back into their current run instead of only showing passive advice.","timestamp":1774971126149,"segment":13,"confidence":null,"iterationTokens":103}
{"run":22,"commit":"81f7684","metric":124,"metrics":{},"status":"keep","description":"Collapsed empty-day rows into a single summary so blank parts of the week no longer waste attention on repeated zero-count pills.","timestamp":1774971219537,"segment":13,"confidence":4.5,"iterationTokens":3881}
{"run":23,"commit":"61be528","metric":129,"metrics":{},"status":"keep","description":"Added a cards-per-note density summary so the timeline reflects not just when capture happened, but how intensively recent note creation turned into study material.","timestamp":1774971308900,"segment":13,"confidence":4,"iterationTokens":6210}
{"run":24,"commit":"77eafe7","metric":132,"metrics":{},"status":"keep","description":"Added an explicit visible week range so the timeline’s last-7-days view is grounded in real dates rather than only a relative label.","timestamp":1774971389551,"segment":13,"confidence":3.4,"iterationTokens":2639}
{"run":25,"commit":"a2cc726","metric":141,"metrics":{},"status":"keep","description":"Added a gap summary and latest-session row highlighting so learners can immediately see how long it has been since their last capture and where to jump back in.","timestamp":1774971523218,"segment":13,"confidence":5.2,"iterationTokens":288}
{"run":26,"commit":"aad4722","metric":147,"metrics":{},"status":"keep","description":"Made the gap, active-days, and visible-range summary pills browseable so the timeline’s meta row now acts as direct navigation instead of passive status text.","timestamp":1774971634109,"segment":13,"confidence":4.571428571428571,"iterationTokens":4957}
{"run":27,"commit":"6c6945f","metric":150,"metrics":{},"status":"keep","description":"Added assistive-tech semantics and labeled summary-pill navigation so the daily timeline remains understandable and actionable beyond the visual layout alone.","timestamp":1774971780527,"segment":13,"confidence":3.6842105263157894,"iterationTokens":8367}
{"run":28,"commit":"eddd384","metric":153,"metrics":{},"status":"keep","description":"Turned the empty Today bar into a create-first-card target so the activity strip can kick off capture directly instead of only reflecting past work.","timestamp":1774971861471,"segment":13,"confidence":3.8,"iterationTokens":2391}
{"run":29,"commit":"5ef63df","metric":155,"metrics":{},"status":"keep","description":"Added a Create today shortcut on the latest-session row so users can convert yesterday’s momentum into a fresh capture session without hunting for the add flow.","timestamp":1774971937599,"segment":13,"confidence":3.076923076923077,"iterationTokens":2068}
{"run":30,"commit":"f803ec7","metric":157,"metrics":{},"status":"keep","description":"Added a top-level Browse today shortcut so users with fresh cards can jump straight back into the newest material without scanning the timeline first.","timestamp":1774972018977,"segment":13,"confidence":3.5,"iterationTokens":2288}
{"run":31,"commit":"32e4fde","metric":163,"metrics":{},"status":"keep","description":"Added explicit bar dates and a quiet-days summary so the weekly strip is easier to read at a glance and makes inactive stretches visible alongside productive ones.","timestamp":1774972159695,"segment":13,"confidence":3.84,"iterationTokens":1442}
{"run":32,"commit":"d0d80f9","metric":166,"metrics":{},"status":"keep","description":"Extended the activity strip with streak, latest-session, and busiest-day highlighting so the mini-visualization communicates momentum and focus points instead of just raw volume.","timestamp":1774972254045,"segment":13,"confidence":3.4,"iterationTokens":3200}
{"run":33,"commit":"7484261","metric":170,"metrics":{},"status":"keep","description":"Added a compact strip legend so the activity bars’ streak, latest-session, and busiest-day highlighting is self-explanatory instead of requiring users to infer the visual encoding.","timestamp":1774972343398,"segment":13,"confidence":3.5483870967741935,"iterationTokens":3083}
<<<<<<< Updated upstream
=======
{"run":34,"commit":"2706d28","metric":177,"metrics":{},"status":"keep","description":"Added a cards-per-active-day pace pill so learners can gauge recent capture intensity even in uneven weeks, not just total volume or density.","timestamp":1774972452916,"segment":13,"confidence":3.875,"iterationTokens":8373}
{"run":35,"commit":"8e7759b","metric":178,"metrics":{},"status":"keep","description":"Preserved overlapping row meanings by letting latest-session and most-active badges coexist, avoiding information loss when the same day satisfies both roles.","timestamp":1774972517154,"segment":13,"confidence":3.8181818181818183,"iterationTokens":2229}
>>>>>>> Stashed changes
{"run":36,"commit":"e6f7811","metric":179,"metrics":{},"status":"keep","description":"Added a dedicated badge group with spacing so overlapping row states like latest-session and most-active remain readable instead of visually collapsing together.","timestamp":1774972696729,"segment":13,"confidence":3.764705882352941,"iterationTokens":1764}
{"run":37,"commit":"2fa0453","metric":0,"metrics":{},"status":"crash","description":"Tried adding a create-here legend cue for the empty Today bar, but a merge-conflict marker slipped into autoresearch.sh and broke the syntax check.","timestamp":1774972847377,"segment":13,"confidence":3.764705882352941,"iterationTokens":1930}
{"run":38,"commit":"f5cf280","metric":181,"metrics":{},"status":"keep","description":"Made the legend explain the dashed Today capture bar and cleaned overlapping-state docs so the strip’s capture affordance and multi-badge rows are self-explanatory.","timestamp":1774975625842,"segment":13,"confidence":3.473684210526316,"iterationTokens":19912}
{"run":39,"commit":"eced4bb","metric":182,"metrics":{},"status":"keep","description":"Added the latest session’s date to the browse-latest-day shortcut so users can confirm the jump target before opening it.","timestamp":1774975700937,"segment":13,"confidence":3.0454545454545454,"iterationTokens":2032}
{"run":40,"commit":"232fc65","metric":183,"metrics":{},"status":"keep","description":"Added today’s date to the Browse today shortcut so the action remains unambiguous around scheduler rollover and late-night capture sessions.","timestamp":1774975778792,"segment":13,"confidence":3.1627906976744184,"iterationTokens":1532}
{"run":41,"commit":"ea84264","metric":184,"metrics":{},"status":"keep","description":"Added a date-anchored visible-week browse action so the week-level shortcut points to a concrete range instead of only saying last 7 days.","timestamp":1774975851131,"segment":13,"confidence":3.2857142857142856,"iterationTokens":1820}
{"run":42,"commit":"70d03d2","metric":191,"metrics":{},"status":"keep","description":"Added a burst-share pill that quantifies how much of the visible week came from the busiest day, helping users distinguish steady capture from one dominant import or generation session.","timestamp":1774976005636,"segment":13,"confidence":4,"iterationTokens":5670}
{"run":43,"commit":"af1121c","metric":200,"metrics":{},"status":"keep","description":"Added a weekly trend pill that summarizes whether capture is rising, steady, cooling, or just starting, so learners do not have to mentally compare the strip bars themselves.","timestamp":1774976131475,"segment":13,"confidence":4.722222222222222,"iterationTokens":3012}
{"run":44,"commit":"4ca65b1","metric":206,"metrics":{},"status":"keep","description":"Made the guidance banner trend-aware so it can nudge users to extend rising momentum, reverse cooling activity, or build a new streak instead of always showing the same restart prompt.","timestamp":1774976215225,"segment":13,"confidence":5.2,"iterationTokens":3261}
{"run":45,"commit":"b0747a7","metric":206,"metrics":{},"status":"discard","description":"Tried adding date bounds to the streak pill so users can see streak start/end at a glance, but the current rubric scored it unchanged, so I’m discarding for now rather than keep a benchmark-neutral variation.","timestamp":1774976353443,"segment":13,"confidence":5.352941176470588,"iterationTokens":10656}
{"run":46,"commit":"47e06a8","metric":214,"metrics":{},"status":"keep","description":"Added an Insight line that interprets the week as bursty, rising, cooling, or consistent before suggesting the next action, reducing the need for users to infer meaning from pills alone.","timestamp":1774976466848,"segment":13,"confidence":5.823529411764706,"iterationTokens":3230}
{"run":47,"commit":"da4ebba","metric":223,"metrics":{},"status":"keep","description":"Added a Review burst day follow-up action so weeks dominated by one big import or generation session can steer users back to that material before they add more.","timestamp":1775007505747,"segment":13,"confidence":5.4,"iterationTokens":9993}
{"run":48,"commit":"e23067b","metric":226,"metrics":{},"status":"keep","description":"Added an Import cards fallback to the empty Today row so starting a new day supports both one-off card capture and larger generated/imported batches from the same spot.","timestamp":1775007622846,"segment":13,"confidence":5.045454545454546,"iterationTokens":4788}
{"run":49,"commit":"58fadb9","metric":230,"metrics":{},"status":"keep","description":"Added Burst session markers to the row and activity strip so burst-heavy weeks are visible at the exact day they came from, not only in summary pills.","timestamp":1775007802993,"segment":13,"confidence":4.791666666666667,"iterationTokens":7661}
{"run":50,"commit":"87c0989","metric":235,"metrics":{},"status":"keep","description":"Added stateful styling to the insight banner so bursty, rising, cooling, and consistent weeks are visually distinguishable before users read the explanatory text.","timestamp":1775007967935,"segment":13,"confidence":4.615384615384615,"iterationTokens":15029}
{"run":51,"commit":"838a913","metric":237,"metrics":{},"status":"keep","description":"Made the guidance banner consistency-aware so nearly-complete weeks now nudge users to protect continuity with a Keep consistency going action instead of a generic restart message.","timestamp":1775008054232,"segment":13,"confidence":4.357142857142857,"iterationTokens":2334}
{"run":52,"commit":"58fadb9","metric":237,"metrics":{},"status":"discard","description":"Tried date-labeling burst-day browse/review actions and busiest-day summaries, but it did not improve the current rubric score, so I’m discarding the benchmark-neutral wording change.","timestamp":1775008576801,"segment":13,"confidence":4.4363636363636365,"iterationTokens":6633}
{"run":53,"commit":"e4fe81d","metric":239,"metrics":{},"status":"keep","description":"Added an Import to rebuild momentum action for cooling weeks so recovery guidance now supports both small manual capture and larger generated/imported batches.","timestamp":1775008654471,"segment":13,"confidence":4.592592592592593,"iterationTokens":2301}
{"run":54,"commit":"35d7f5c","metric":244,"metrics":{},"status":"keep","description":"Made the insight banner itself browseable so users can jump directly from the panel’s interpretation into the relevant recent-trend or burst-day view.","timestamp":1775008815793,"segment":13,"confidence":4.526315789473684,"iterationTokens":10723}
{"run":55,"commit":"732f9e8","metric":244,"metrics":{},"status":"discard","description":"Tried date-labeling streak, latest-day, burst-day, and busiest-day affordances so browse targets were more explicit before click, but the primary score stayed flat, so I discarded the benchmark-neutral wording pass.","timestamp":1775020836042,"segment":13,"confidence":4.161290322580645,"iterationTokens":10723}
{"run":56,"commit":"8a37e23","metric":246,"metrics":{},"status":"keep","description":"Date-labeled streak, latest-day, burst-day, and busiest-day affordances while preserving the burst summary context, so browse targets are explicit before users click without losing the weekly interpretation.","timestamp":1775020929139,"segment":13,"confidence":4.09375,"iterationTokens":6363}
{"run":57,"commit":"a7c15a0","metric":248,"metrics":{},"status":"keep","description":"Made streak browse actions explicitly date-bounded in the visible guidance and metadata so reopening the current or last run now shows the exact range before users click.","timestamp":1775021014908,"segment":13,"confidence":4.15625,"iterationTokens":3002}
{"run":58,"commit":"f657752","metric":251,"metrics":{},"status":"keep","description":"Reframed the missed-today recovery action as Resume last capture while keeping the date visible, so the banner now encourages continuity instead of treating the latest session as passive history.","timestamp":1775021148644,"segment":13,"confidence":4,"iterationTokens":4962}
{"run":59,"commit":"2a41481","metric":253,"metrics":{},"status":"keep","description":"Clarified the activity-strip helper so it now tells users that each bar summarizes that day's cards across notes, improving discoverability of what the mini-visualization means before they click.","timestamp":1775021294006,"segment":13,"confidence":3.8333333333333335,"iterationTokens":9281}
{"run":60,"commit":"c5c61ad","metric":258,"metrics":{},"status":"keep","description":"Collapsed consecutive empty non-today rows into a Quiet stretch summary so blank parts of the week stop repeating the same empty state and active capture days stand out sooner.","timestamp":1775022086253,"segment":13,"confidence":3.763157894736842,"iterationTokens":9875}
{"run":61,"commit":"c5c61ad","metric":258,"metrics":{},"status":"discard","description":"Tried visually emphasizing the panel-level Resume last capture shortcut so the recovery path stands out alongside the primary actions, but the primary score stayed flat, so I discarded the benchmark-neutral styling pass.","timestamp":1775022208578,"segment":13,"confidence":3.6666666666666665,"iterationTokens":4118}
